"","국내야구","스트레이.키즈","프로듀스.X.101","만화","수능","스트리머","기타.국내.드라마","리그.오브.레전드","대출","겨울왕국"
"1","김정일도 픽한 김연자인데 ㅋㅋㅋㅋㅋㅋㅋ","[2차][러블리즈갤]<U+2B50>Moonlight<U+2B50>신곡 축하왔어요(^_^)설쉬","엘사인데, 김우석이 엘사보다 이쁜겄갓긔","난 어릴적 초과학을 동경했어","수능 평균5등급이 1년만에 연고대가는애니추천좀","루사언니 모르겠으니까 채팅창 여는거 레전드 ㅋㅋㅋㅋ","뷥 개막장 드라마 ","이유없이 비추 폭탄 ㄱ","파봏형 제가 대갤에 나름 신용도잇고 응원론길게햇는데대나여","(유머)엘사가 놀리면??"
"2","절며절며 ㅋㅋㅋㅋㅋㅋㅋㅋㅋㅋㅋㅋㅋㅋㅋㅋㅋㅋㅋㅋㅋㅋㅋㅋㅋㅋㅋㅋㅋㅋㅋㅋㅋㅋㅋ","[황윤성마갤] <U+2763>쁘띠<U+2763>가 신곡축하왔<U+2728>윤성<U+2728>(설쉬)(\&@)","ㅇ","술담배는 시간이 해결해주는듯","“얘를 슬프게 하는 놈은 아주씨발 담가버린다”","포켓몬도 컨트롤덱이있냐","부사장 본처한테 자식이 없어?","4용 뺏기면 백정애미 칼로찔러죽여도 무죄 ㅇㅈ하냐?","나 좆목들구제안한다 씨발 ㅋㅋㅋ","벗겼더니 가슴 개크네"
"3","야요미가 더 잘부르는데?","[2차][포디콰갤]<U+2744>Comfort<U+2744>신곡축하 왔디콰♬설x","끄붕이 트리랑 눈사람 달고싶긔","부엌에 바퀴벌레 3마리 돌아다니는거 보고식겁했다","공부잘하는애들중에 미친놈 많은건 팩트임","노돌리 던 거르고 짬타 공 고른건솔직히에바다","이상윤 놈로맨틱해","ㄴ 이유없이 개추 폭탄","깔끔하고 공정하게 배식하겟슴니다 한븐만요","싱어롱 하면 어디서 해야 국룰이냐?"
"4","와 ㅋㅋㅋㅋㅋㅋㅋㅋㅋㅋㅋㅋㅋㅋㅋㅋㅋㅋㅋㅋㅋㅋㅋㅋㅋ ","[황윤성마갤] <U+2763>쁘띠<U+2763>가 신곡축하왔<U+2728>윤성<U+2728>(설쉬)$%#","고닉깅이들아 알록달록한 윾동이들은 패지마ㅡㅡ","우욱씹 하는애들 좀 게이같음 ","아 마크 스카이블럭 하고 싶다 ㅋㅋ","왜냐맨 vs 래퍼드 누가더 코칭 잘함?","이상윤은 쟤랑 잘어울린다","고양이 괴롭히는 짤들은 어디서 볼 수 있냐?","배식 후보자 댓글 달아라","제발 더빙 싱어롱 앙망한다"
"5","빡겜하시네 ㅋㅋㅋ","[황윤성마갤] <U+2763>쁘띠<U+2763>가 신곡축하왔<U+2728>윤성<U+2728>(설쉬)(\","눈사람 놈들 자꾸 콘으로 헷갈려","그 아다가키 아키? 이년 나오는 만화 제목이 머였지","공부 착실히 꾸준하게 해서 실력 쌓는 재미가 있네","룩공 실력차 확실하네ㅋㅋ","내가... 니 옆에 있을께","뼛속까지 탑솔러","ㅋㅋ 1월 7일에 군대간다..형들 눈물나네..알바만하다","나이드니까 645니 싱어롱이니 먼가 전보다 별로임"
"6","저게 트로트다","[2차][AB6IX갤]♥BLIND FOR LOVE♥신곡축하왔에삐<U+2764>(설X)","선물상자 왜 안되농","버밀리오콘 오늘 만든 건데 쓰쉴?","↑현실에서도 이지랄하고 다니니까 친구가 없지 ㅋㅋㅋ","근데 얼귀 역겹긴 하네","애미뒤진거보다 이상윤온게 더 기쁠듯 ㅇㅇ","강간 당해서 멘탈나간 고딩녀","윷놀이 7시간하신분?","싱어롱 그 많은 사람이 입김 뿜어대면"
"7","이악물고 부르넼ㅋㅋㅋㅋㅋㅋㅋㅋㅋㅋㅋㅋㅋㅋㅋㅋㅋㅋㅋㅋㅋㅋㅋㅋㅋㅋㅋㅋㅋㅋ","[황윤성마갤] <U+2763>쁘띠<U+2763>가 신곡축하왔<U+2728>윤성<U+2728>(설쉬)(특문)","온냐들 이정도면 반고로 쳐줌????","귀귀가 그린 드래곤볼 아냐","현재 중3 수붕이 질문좀","혜요 씨발년이 룩삼은 0원이야 개년아","긷줌들 유독 불륜에 열폭심해 ㅇㅇ",".","걍 구제받는겸 제가 배식하겠습니다","어차피 이번건 645 해봣자 드립할거도없어"
"8","요요미 ㅋㅋㅋㅋㅋㅋㅋㅋㅋㅋㅋㅋㅋㅋㅋㅋㅋㅋㅋㅋㅋㅋㅋㅋㅋㅋㅋㅋㅋㅋㅋㅋㅋㅋㅋㅋ","[2차][AB6IX갤]♥BLIND FOR LOVE♥신곡축하왔에삐<U+2764>(설X)","엓 flash랑 이거랑 비슷하지않아?","서울대.... 떳냐?","홍대 붙여주면 네발로 기어드갈 자신잇음","귀엽긴해 ㅋㅋ","세기의사랑이네","아니시발 서포터새끼들 딴건다참겟는데 시에스 처먹는건 못참겟더라","아무나 배식시켜주세요 파볼형 ㄱㅅㄱㅅㅅㅅㅅ","심야로 보면 무슨영화던 항시 싱alone 할 수 있는 영화관"
"9","당신은철사룰로두손꽁꽁ㅋㅋㅋㅋㅋㅋㅋㅋㅋㅋㅋㅋㅋㅋㅋㅋㅋㅋㅋㅋㅋㅋㅋㅋㅋㅋㅋㅋ","[2차][정동하갤]<U+2764>이별을노래로만들어보았습니다♥신곡축하(설쉬)","망구들 앰 80프로 빠져도 윙보단 잘팜","찌그러진핑크빈콘 너무중독성강해..","잘생기면 조용한 찐이어도댐","씨발 그만 징징대 잡년아~","그래 남자답게 정면돌파해야지","LCK 전성기...jpg","딸렐이 배식하면 좆목들만 다 받을건데 다들 포기해라 ㅋㅋ","야 니들 당연히 6시45분꺼 가겠지?"
"10","잘하느ㅋㅋㅋㅋㅋㅋㅋㅋㅋㅋㅋㅋㅋㅋㅋㅋㅋㅋㅋㅋㅋㅋㅋㅋㅋ","[2차][정동하갤]<U+2764>이별을노래로만들어보았습니다♥신곡축하(설쉬)","앨범사고 팬싸다니면"," 만갤 틀딱들 다 죽여버리고싶은데 어쩌지","다서울대야씨발","예전에 고닉중에 얼음귀신 있지 않음??","이거 첩자식 거르고 만나라는 드라마냐","실시간 본인 카톡 상황...jpg","대리배팅해주러갈께요 ㅂ","근데 645? 뭐임"
"11","빡겜하노","[2차][정동하갤]<U+2764>이별을노래로만들어보았습니다♥신곡축하(설쉬)","김우석 앰인데, 엘사로 갈아탓긔",".","대졸이 취업할때","ㅂㅅ들아 혜요는 와꾸 얼굴담당이니 200은 썻어야지 ㅅㅂ","아 시발새끼야","올스타 여성 관객 팬티 노출","파볼형 저번에 배식정했을때 이누형1위 제가2위였는데","요"
"12","존나잘하네 ㅋㅋㅋㅋㅋ","[2차][AB6IX갤]♥BLIND FOR LOVE♥신곡축하왔에삐<U+2764>(설X)","언냐들?ㅋ 나는 눈오는 올랖","오예스 신상품.....jpg","고대 간호 연초에 4칸인데 상향으로 지를까??","왜 롤하지도 않는사람들이 자낳대 나오냐","둘이 혼외자 낳으면 딱맞","레딧)유미 신스킨유출.jpg","두배론하면더할사람있냐 혹시?","ㄹㅇ 프1싱어롱은 프로즌하트로 서로 눈치확인하고"
"13","마이크 어디가노 ㅋㅋㅋㅋㅋㅋ","[2차][정동하갤]<U+2764>이별을노래로만들어보았습니다♥신곡축하(설쉬)","ㅋ","수갤 댓글보는데 와;;","마인크래프트) 1.12.2 버전 . 마인팜, 스카이블럭 하자.","역시 얍얍이가 젤 잘살려 ㅋㅋ","정선이는 같은 아픔을 겪었는데도 자기 아픔만 중요했고","은다솜 일본서버 근황.....opgg","5000원급구라니가요...","용아맥 금요일은 가능성 없냐?"
"14","오우ㅋㅋㅋㅋㅋㅋㅋㅋㅋㅋㅋㅋㅋㅋㅋㅋㅋㅋㅋㅋㅋㅋㅋㅋㅋ","ㅋ","이제 잘준비 하러감","신없세 아빠 언능 데려오라고 ㅋㅋ","이건 머 산구석에 학교가 있노","유찰을 10원에 모셔갔으면 고마운줄이나 알지","내가 니 옆에 있을게 가 온유리였어 ㅋㅋㅋㅋ","양말 트리가 뭔데 다들 그러냐","없다 이제 시발...","정령님 쿠션그리없냐진짜"
"15","미아리고개 ㅋㅋㅋㅋㅋㅋㅋㅋㅋㅋㅋㅋㅋㅋㅋㅋㅋㅋㅋㅋㅋㅋㅋㅋㅋㅋ ","[2차][다이아갤] 유툽 허니스 ♥ 신곡 축하요! <U+2615>설쉬/ ","새끼 보고싶다","무중력보이즈가 아직도 번역 안된건 의외였음","bis 법이냐 경제냐","룩삼도 못하는데 룩삼보다 못하는 공가는 얼마나 못하는거냐? ㅋㅋㅋ","헐 예고에  내가 니옆에 있을게가","다이아 장인) 제드의 장점","나 아픈가봐 머리도 찡하고 콧물도 나오고","싱어롱은 긔냥 갤럼들끼리 645처럼 찍고 가야 성공할 것 같은데"
"16","당신은 ㅋㅋㅋㅋㅋㅋㅋㅋㅋㅋㅋㅋㅋㅋㅋㅋㅋㅋㅋㅋㅋㅋㅋㅋㅋㅋㅋㅋㅋㅋㅋㅋㅋㅋㅋㅋ","[2차][정동하갤]<U+2764>이별을노래로만들어보았습니다♥신곡축하(설쉬)","입장발표 이번달은 안넘기겠지?","지금 호감고닉밖에없네 ㅇㅇ","똥꼬 간지럽다","딜포터년 딜도 보지에 박고 오함마로 찍어야함","이거 ㄹㅇ 결말 어찌되냐???ㅅㅂ","발기 참기 레전드","시ㅁ발련들아 추워뒤지겠다고 핫팩이라도 하나사줘","나나나헤야 떼창좀 기대되는디"
"17","화약연기앞을가려 ㅋㅋㅋㅋㅋㅋㅋㅋㅋㅋㅋㅋㅋㅋㅋㅋㅋㅋㅋㅋㅋㅋㅋㅋㅋ ","[2차][조유리갤] 유리의 <U+2B50>신곡축하<U+2B50>로 ♪내게 널 보여줘♪(설쉬)","210.90이 알고보니 컵스프면 웃기겠긔","다같이 반고닉 ㅇㅇ하자","↑대체 그런글은 왜씀? ","근데 오늘 한동숙 시청자 왜캐 없음?","정선이 흑화 시급하다","LL stylish 닉 풀렸다 먹을새끼 먹으셈","맨날돈없단소리도지겹내줒같은자ㅡ슥들","싱어롱인데 일반관에서 하는게..."
"18","눈못뜨고헤매일때 ㅋㅋㅋㅋㅋㅋㅋㅋㅋㅋㅋㅋㅋㅋㅋㅋㅋㅋㅋㅋㅋㅋㅋ","[2차][정동하갤]<U+2764>이별을노래로만들어보았습니다♥신곡축하(설쉬)","디시 양말트리로 수억벌겠네","저도 디시콘 제작하던거 있는데","사농공상","혜요는 유찰안된걸 감사해야지 ㅋㅋㅋ","헐 미치 ㄴ","크기 vs 테크닉 롤붕이들의 선택은?","파볼형 그냥 제가 구제할게요","동머구 메박 싱어롱 모여라 이기야"
"19","화약연기앞을가러눈못뜨고헤매일때ㅋㅋㅋㅋㅋㅋㅋㅋㅋㅋㅋㅋㅋㅋㅋㅋㅋㅋㅋㅋㅋㅋㅋㅋ","[2차][김요한마갤]<U+2728><U+26A1>FLA+H<U+26A1>하게 신곡 축하 왔어욯<U+2728><U+2763>(설X)","누가 고닉 팼노 윾동 창련들이","「어린 시절, 나는 정의의 사도를 동경했었어」","이거 다고 눈임?","혜요 지금 옥자보다 포인트 낮아서 기분 팍 상함 ㅋㅋㅋ","나정선 어디론가 전화를 거는데, 사장이 전화 받는데","제드는 궁그림자도 바로 못타고 사장됏음","파볼형 제발 배식한븐만요","근데 항상 궁금한건데 엘사가 있는데 병풍은 어떻게 얼음장사함?"
"20","야요미가 이겼네 ㅋㅋㅋㅋㅋㅋㅋㅋㅋㅋㅋㅋㅋㅋㅋ","[2차][김요한마갤]<U+2728><U+26A1>FLA+H<U+26A1>하게 신곡 축하 왔어욯<U+2728><U+2763>(설X)","고닉깅이들 귀여워서 윾동이도 하트 달았긔","ㅅㅂ 좋겠다 알바했는데 알바하는 누나가 앵기기도 하고","두원공대 동강대 강남대 줄여서 두동강ㅋㅋ","똥숙견들은 훈수보면 발작을 일으키네 ㅋㅋ","온유리랑 박성준이랑 이어졌는데 또 누가 불륜할듯 ?","요플래인가 뭔가 피글렛닮았네","아니너네 근데 배식할애 정햇노?","용아맥"
"21","임이 넘던 이별 고개 ㅋㅋㅋㅋㅋㅋㅋㅋㅋㅋㅋㅋㅋㅋㅋㅋㅋㅋㅋㅋㅋㅋㅋㅋㅋㅋㅋㅋ","[2차][조유리갤] 유리의 <U+2B50>신곡축하<U+2B50>로 ♪내게 널 보여줘♪(설쉬)","윾동탄압","본인 버스 반대행타서 다시타고 집가는중ㅁㅌㅊ?","고1수붕이 학원 다 끊기로 했다","혜요 뒤끝 조지네 ㅋㅋㅋ","존나 화나노","양말 트리 씨발 난 안주노 ㅠㅠ","한솔형 5플5대리뱃 날카롭네","싱어롱 음치라 못감"
"22","케요미 우승 ㅋㅋㅋㅋㅋㅋㅋㅋㅋㅋㅋㅋㅋ","[2차] [김요한마갤]<U+2728> <U+26A1>FLA+H<U+26A1>하게 신곡축하 왔어욯<U+2728><U+2763>(설X)","눈사람이 솔직히 젤 귀엽긔","꼭 팩트를 가져와야해요 구라쌉놈샛기가 진짜","이번 수능 국어 경제 지문 나왔냐?? ","소우릎은 걍 코치가 아니라 인게임에서 오더를 해야하는데 ㅋㅋㅋ","이상윤 ㅅㅂ놈","강간 당한 고딩","한명이라도 절 구제....","재송한데 프1싱어롱은 프로즌하트 있어서 스타트 텐션 미친놈상태로가는건데"
"23","빡겜하놐ㅋㅋㅋㅋㅋㅋㅋ","[2차][TWICE갤] <U+2B50>FEEL SPECIAL<U+2B50> 신곡축하 설첫<U+2B50>","112.154 시발년 칼푹찍해서 눈깔 도려내고싶노 ㅋㅋㅋ","아까 공차에서 녹차 스무디에 초코 들어간 신메뉴 궁금해서","대학가면 여친사귀냐","진짜 방송도 겜도 노잼으로하네","나정선이 새 사장과 함께 복수하는 이야기 되나","(약혐)진짜 현실에서 탑신병자 미친놈 본게","조민수씨 부결입니다 삐ㅡ빅","포티 자강두천 선택좀"
"24","아모르파티나가자ㅋㅋㅋㅋㅋㅋㅋㅋㅋㅋㅋㅋㅋㅋㅋㅋㅋㅋㅋㅋㅋㅋㅋㅋㅋ","현진이파트 어디야?!","유동년들 시비건다고 탈갤하지마 고닉언냐들<U+2763><U+2763><U+2763>","와 시발 폰헙에 이거 뭐냐 ㅋㅋ","수갤 미친새끼들임? 서울대 허1벌이네 ㄹㅇ 씨발","누가 자낳대팀 좀 올려줘라","저 연놈들 폭망하기를","아칼리 씹새끼는 너프를 처먹어도 개사기네","민석아 좀주라","코엑스 점장문학마렵다 ㅋㅋㅋㅋㅋㅋㅋㅋㅋㅋㅋㅋ"
"25","태연자ㅋㅋㅋㅋㅋㅋㅋㅋㅋㅋㅋㅋㅋㅋㅋㅋㅋㅋㅋ","공식 1기 추가가입 키트 배송비 결제하다가 튕겼는데","고닉 달고 일상갤 열어서 까플 없어진 건데","좆같은 새끼들에겐 좆같은 디시콘이 딱이야","우리학교 좆반고 남곤데 정시파이터 하나만 잘감","아 혜요 진짜 미치겠네 ㅋㅋㅋㅋㅋㅋㅋㅋㅋㅋㅋㅋㅋㅋ","지랄을 하네 진짜 ","이건 먼상황임?","족가지마","프폭도가 남들한테피해줘서 프폭도라고 별명붙여진거임?"
"26","레벨 다르긴하네 ㄹㅇ","[2차][AB6IX갤]♥BLIND FOR LOVE♥신곡축하왔에삐<U+2764>(설X)","끄붕인 손이 너무 길쭉해서 징그럽긔","좆간이 미안해...","좆반고 문과 정시로 성한중경시외 뚫으면 ㅁㅌㅊ냐","저새낀 뭐 재테크하고 다니나?","폭탄까지 던져놓고   가네. 미친넘","님들아 선 리안드리 티모가 선 얼건 오른한테 지는 이유 좀","파워볼 고슈 즉 내 피섞인 가족 즉 쌍둥이","이럴줄알았으면 타오바오 포스터 여러개 살걸"
"27","임이넘던이별고개ㅋㅋㅋㅋㅋㅋㅋㅋㅋㅋㅋㅋㅋㅋㅋㅋㅋㅋㅋㅋㅋㅋㅋㅋㅋㅋㅋㅋ","[2차][정승환갤 ]<U+2764>십이월이십오일의고백<U+2764>신곡 축하왔싕(설×)","교정해본 프붕이","왜 신만이 아는 세계 얘기는 안함","???: 삼세판 졌으면 꺼져","플딱 넷보다 다딱2+골드2가 더 센거같은데","혐유리 혐성준 ㅅㅂ","갱플귤이사기인이유...","노숙자새끼 손꾸락으로 내닉이 오르락내리락하는게 좆같네","싱어롱갤에 미안하다.."
"28","미아리눈물고개ㅋㅋㅋㅋㅋㅋㅋㅋㅋㅋㅋㅋㅋㅋㅋㅋㅋㅋㅋㅋㅋㅋㅋㅋㅋ","[2차][아이들갤]<U+2764>LION<U+2764>처럼 신곡 축하 왔사자<U+2763>(설x)1","머식 빨아본 온냐들 댓글 부탁","아니 그래서 점프 신작 번역 언제뜨는데!!!!","서울대 간호랑 연대 노문","방금 혜요: 소우릎님 저 십원짜리 계획된거 였나요 ?","니 옆에 있는데 아오 ㅋㅋㅋ","이해하면 무서운사진","빵득아 나 언급하지마 씨발 기분더러우니까","스벤마차타고 가는 짤 있는사람 없냐??"
"29","미아리고개 ㅋㅋㅋㅋㅋㅋㅋㅋㅋㅋㅋㅋㅋㅋㅋㅋㅋㅋㅋㅋㅋㅋㅋ","TWICE갤러리) <U+2B50>FEEL SPECIAL<U+2B50> 신곡축하 설첫♡","조는 한이야 결이야","님들 잘껀데 '그거'달아주셈","코난T 대학동기들은 무슨 일함?","지 시청자수 떡락시키듯이 텐션도 개같이 떡락시키네","미친 새끼","페미니즘을 지지해야 하는 이유...jpg","파볼형 개 ㅅㅅㅅㅅㅅㅅㅅㅅㅅㅅㅅ","아 내동네 프2관 확 줄어들기 시작했네"
"30","우미관창법ㅋㅋㅋ","[2차][러블리즈갤]<U+2B50>Moonlight<U+2B50>신곡 축하왔어요(♬)설쉬","크트야사랑해<U+2763>+<U+2763>+ ","양심고백)","3합 6도 못맞추는 놈이 고대 들어가는건 말이 안되지","사신 이번엔 어느팀 코치임???","장나라 바벨대표랑 잘될 가능성 없냐","야스오 스웨인 누가 편함??","딸렐이 맞으면 지덕분이라고  배식달라고하고틀리니","마스크끼고서 존나 아닌척하고 부르셈"
"31","요요미가 누군데? 하는 행동 하나하나 싸이코같은데??","[2차][조유리갤] 유리의 <U+2B50>신곡축하<U+2B50>로 ♪내게 널 보여줘♪(설쉬)","난 어두운 분위기 하면 안되겟노","달빛천사도 이젠 틀이야?","존나 현타 오네","씨발 겜스타일도 개노잼이네ㅠㅋㅋㅋㅋㅋ","둘다 죽어 ㅅㅂㅅㅂㅅㅂ","제이스 정복자에 침착이나 승전보냐","ㅅ ㅅ ㅅ ㅅ ㅅ ㅅ ㅅ ㅅ ㅅ앞자리5빅구제ㅛ ㅅ ㅅ ","항상느끼는건데 목에 뭔가가 껴있는 느낌임"
"32","미아리 눈물 고개 ㅋㅋㅋㅋㅋㅋㅋㅋㅋㅋㅋㅋㅋㅋㅋㅋㅋㅋㅋㅋㅋㅋㅋㅋㅋㅋㅋㅋㅋㅋ","[2차][조유리갤] 유리의 <U+2B50>신곡축하<U+2B50>로 ♪내게 널 보여줘♪(설쉬)","진짜 좆병신년들 정력 머단하노","다음주 토요일에 드슈 2기 나온다 ㅇㅇ","문과 전과하는게 맞냐","저새끼 그냥 카피만 하고 기술 특징 모르네 ㅋㅋㅋㅋ","본처에게 불 지르고 첩년에게 런","모쏠후다어떻게생각함??","머노 왜 알람이안ㅋ뜨농 ㅅㅅㅅㅅㅅㅅㅅㅅ 준혁이형 ㅅㅅㅅㅅ","첫 싱어롱이라 기자들 와있는거 아님?ㅋㅋㅋ"
"33","미아리눈물고개ㅋㅋㅋㅋㅋㅋㅋㅋㅋㅋㅋㅋㅋㅋㅋㅋㅋㅋㅋㅋㅋㅋㅋㅋㅋㅋㅋㅋ","[2차][정승환갤 ]<U+2764>십이월이십오일의고백<U+2764>신곡 축하왔싕(설×)","커비 기분 조으니까 갤밀 같이해줌 ㅋ","탑의 관리가 요즘 떠오르는 이세계네","수갤에 서울대생이 많은게 아니라","얍얍이 방송 준비를 잘 했다니? 얍얍 과소평가하고 있네 미친새끼 ㅋㅋ","와 시발새끼","짤녀 이쁘면 자러감","족가","코엑스 mx 쿼터 얼마나 남음???? 싱어롱 못열려나??"
"34","ㅁ개나대노ㅋㅋㅋㅋㅋㅋㅋㅋㅋㅋㅋㅋㅋㅋㅋㅋㅋㅋㅋㅋㅋㅋㅋㅋㅋ","TWICE갤러리) <U+2B50>FEEL SPECIAL<U+2B50> 신곡축하 설첫♥","양말 이거 다른걸로 못바꾸노","마나모아켰다","잘생긴 찐따는 왜 잇는거임?","왜냐맨팀 루사 기다리기 포기하고 해산 ㅋㅋ","애초에 첩의자식이란얘기 안한거부터 ","야스오하려면 ㄹㅇ 지피지기가 중요하더라","마저묵던술 먹으러간다","아 좌표 찍으라구"
"35","우미관 감성 ㅋㅋㅋㅋㅋㅋㅋㅋㅋㅋㅋㅋㅋㅋㅋㅋㅋㅋㅋㅋㅋㅋㅋ","[2차][하이라이트갤] 신곡 축하왔으니 <U+2764>편해지자<U+2764> 설X","수달깅 그줌한테 피뎁 따였긔 ㅜ","만갤에 고닉 웰케 많음","편입하려면 학점은행제 하는게 나음?","루사 밥상 엎는거 진짜 개좆 같네","장나라는 가장 좋은 일이고, 온유리는 어쩔수 없는 일이라는고","정글이 캐리력 있다 생각함??","뭔 ㄹㅇ이야 빵득이줫병 ㅡ신아 동조하지마 빙 ㅡ신아","저희 추억이 잇는데 걍 코엑스에서 하져"
"36","미아리 복스 ㅋㅋㅋㅋㅋㅋㅋ","[2차][김요한마갤]<U+2728><U+26A1>FLA+H<U+26A1>하게 신곡 축하 왔어욯<U+2728><U+2763>(설X)","우석공쥬에 이어 강마스도 컨셉떨어짐","나중에 백인여자아이로 입양해야겠음","간단한 아다 구별법","생각할수록 옥혐얍끠 존나아깝네 ㄹㅇ","피는 못 속인다","서울대 교수 ㅈ도 쓸데없는 이유.jpg","딸렐이 믿엇는데 씹창년 그래도 30출 ㅇ","싱어롱 가본사람많나요??"
"37","월북송 ㅋㅋ","TWICE갤) <U+2B50>FEEL SPECIAL<U+2B50> 신곡축하 설첫특문","윾동탄압","씨발게이새끼들도 젖꼭지맞추기 게임하네","근데 건동홍도 강대받아주노","88도 예전에 자낳대 출전하지 않았냐?","첩자식들끼리 결혼해~~~","애들아 카이사 R 아군이 때렸을때 표식 남는 기준이 뭐임 ?","ㅎ ㅏ","이색깔의 브루니는 좀무섭군"
"38","ㅁ ㅋㅋㅋㅋㅋㅋㅋㅋㅋㅋㅋㅋㅋㅋㅋㅋㅋㅋㅋㅋㅋㅋㅋㅋㅋㅋㅋㅋㅋㅋㅋㅋㅋㅋㅋㅋㅋㅋ","[2차][하이라이트갤] 신곡 축하왔으니 <U+2764>편해지자<U+2764> 설X","나 최근 조 이짤 노무 멋있오","소아온 첨볼땐 아인크라드 스토리만 나올줄알았는데","수시랑 정시에서 줄타기하는 놈들이 젤 대학 잘가더라","지각도해 ㅋㅋ 방송준비도안해ㅋㅋ경기는노잼ㅋㅋ","내가있을게가 온유리한테 하는말","솔직히 뷰지뷰지 거리는거 너무 저급함 ㅡㅡ;","3처넌이라도급하심분","님드라 팝콘은 어디 팝콘이 젤 맛남?"
"39","단장의미아리텍사스 ㅋㅋㅋㅋㅋㅋㅋㅋㅋㅋㅋㅋ","[2차][조유리갤] 유리의 <U+2B50>신곡축하<U+2B50>로 ♪내게 널 보여줘♪(설쉬)","승석 단둘이 있으면 어색할 것 같음?","야한 여중생.jpg","보지인증 간다","룩삼 겜스타일도 노잼이네 ㅋㅋㅋㅋㅋㅋㅋㅋㅋ","와 대사봐 ㅅㅂ","달1.","13일월급인데 두배주께 도와줘라","엘사안나 호모갤 설국열차갤러리"
"40","미아리 고개 ㅋㅋㅋㅋㅋㅋㅋㅋㅋㅋㅋㅋㅋㅋㅋㅋㅋㅋㅋ","[2차][AB6IX갤]♥BLIND FOR LOVE♥신곡축하왔에삐<U+2764>(설X)","섹스쓰리 언냐 섹스식스가 젤 입에 잘붙긔","아 섹스마렵다","좆반고 정시충들은 희망이 없다","얼방 방밀을 여기서도 씨발ㅋㅋㅋㅋㅋㅋ","불륜 정당화 하는 이유가 참 하찮다","념글 이건 멀리서 보면 구분 안될거같은데","딸랠아 그건좀추한디.. 귀엽게봤는디..","야 근데 목동 저거 토욜이라 ㅋㅋㅋㅋㅋ 대형사고 각이다 ㅋㅋㅋㅋㅋ"
"41","ㅁㅋㅋㅋㅋㅋㅋㅋㅋㅋㅋㅋㅋㅋㅋㅋㅋㅋㅋㅋㅋㅋㅋㅋㅋㅋ","TWICE갤) <U+2B50>FEEL SPECIAL<U+2B50> 신곡축하 설첫♡☆","양말새끼들 배척하기저네 트리로 바꿔 ㅋ","뭐냐 저거 닉넴옆에있는거 왤케 귀여움","투표붕어 탈출은 지능순","어디가 젤 재밋냐?","진짜 지랄하네 ㅋㅋㅋㅋㅋㅋㅋㅋㅋㅋㅋ","케인 시작할때 원하는걸로 변신하고 시작할수 있으면 몇티어 가능?","이번꺼 파언","또하나의 이야기 원서가 컨실돈삘임??"
"42","단장의미아리고개ㅋㅋㅋㅋㅋㅋㅋㅋㅋㅋㅋㅋㅋㅋㅋㅋㅋㅋㅋㅋㅋㅋㅋㅋㅋㅋㅋㅋ","[2차][하이라이트갤] 신곡 축하왔으니 <U+2764>편해지자<U+2764> 설X","트윗터 친구해요 @yocat_sleep","신이 없는 세계에서 왜 쓰레기인지 설명좀","나형 쎈 다 풀 줄 알면 1컷 뜸?","룩삼 방밀하네 ㅋㅋ","결국 온유리한테 내가 네 옆에 있을게 이지랄","롤린이 정글 상담받으로 왓으오","가족이되실분.","지방에도 싱어롱 열림?"
"43","56년???","TWICE갤) <U+2B50>FEEL SPECIAL<U+2B50> 신곡축하 설첫♥","새로 고닉판언냐들 유동년들 시비터는거 받아들여ㅋ","어이가 없네","아주대 논술 발표언제냐 게이들아","이제  여캠년들 포켓몬 따라할듯","저둘망하는거봐야겠어","늅늅이 질문함","아시브ㅏㅂㄹ담배한갑만 사주라 ","여기 롯시 다니는 게이 있냐? 팝콘 무슨맛이1선발임?"
"44","비장 ㅋㅋㅋㅋㅋㅋㅋㅋㅋㅋㅋㅋㅋㅋㅋㅋㅋㅋㅋㅋㅋㅋㅋㅋㅋㅋㅋㅋㅋㅋㅋㅋㅋㅋㅋㅋㅋ","[2차][러블리즈갤]<U+2B50>Moonlight<U+2B50>신곡 축하왔어요(<U+2022><U+0300>㉨<U+2022><U+0301>)설쉬","조승연 한남","이제 만갤에 짤 관련 주저리 쓰면 안됄듯","대학생은 둘로나뉘는가같음 ㅋㅋ","루사 진짜 ㅋㅋㅋㅋㅋㅋㅋㅋㅋㅋㅋㅈㄴ노잼경기하네","회사사람들 올텐데 저러고있으면 금방 소문나겠다","여자들 진짜 남친 자지 작으면 이딴생각함?","5000원 급구 긴급상황 sos  구제요청.위급한상황 도와주세요 ","흠 일반싱어롱갔다가 옆자리 일반인잇음 낭패일수도있음"
"45","태연 30년후 김연자 처럼 될것 같노","TWICE갤) <U+2B50>FEEL SPECIAL<U+2B50> 신곡축하 설첫<U+2763>","[단독] '빅톤' 한승우 합류후 리패키지 앨범 계획 들통났다...","그 많던 반고닉이 모두 사라졌어","아직도 원서 넣는 사람 ㅠㅠㅠ","항상 ㅈ노잼으로 게임하는데 그것도 남카피임ㅋㅋㅋㅋㅋㅋㅋ","저거 기자한테 찍히길","소녀전선이 꼴잘알 겜인 이유.jpg","파볼잘해병신아 ㅋㅋ 바카라 홀짝을 못하지","싱어롱 친구한번 꼬셔볼까"
"46","치트키 쓰노 ㅋㅋㅋㅋㅋㅋㅋㅋㅋㅋㅋㅋㅋㅋㅋㅋㅋㅋㅋㅋㅋㅋㅋㅋㅋㅋ ","[2차][무소속]컴백축하드립니다","한 무대 멋있어","치킨시켰다","ㅇㅇ","룩공 게이싸움 뭐하냐","내가있을게 ㅇㅈㄹ","리신 시즌3 부터 했던 장인들은 아는데","아니 있으면 도와주지 애들아...","님들 저희 화력집중 날짜나 쪼인합시다"
"47","먼노래고ㅋㅋㅋㅋㅋㅋㅋㅋㅋㅋㅋㅋㅋㅋㅋㅋㅋㅋㅋㅋㅋㅋㅋㅋㅋ","[2차][하이라이트갤] 신곡 축하왔으니 <U+2764>편해지자<U+2764> 설X","아 눈사람 너무 귀엽다 저거 달고싶어","만붕이한테 4500원빌리고 우울증갤에서 1만원빌리고","김지민이 누구임?","긴급속보... 새봄냥쓰 오늘의 게임 jpg","빅히트 연습생 지침서","와 괴물쥐 2019빠르게성장한 한국유튜브순위5위 ㄷㄷ","좆같네","싱어롱때까지 기상후 날계란 하나씩 먹을것"
